Title,Channel,Views,Likes
Florida vs. Houston - 2025 men's national championship extended highlights,March Madness,695049,8869
Florida vs. Houston Wild Ending 🍿 Final 2 Minutes of the National Championship | 2025 March Madness,Bleacher Report,642300,4885
Bad Bunny: Tiny Desk Concert,NPR Music,3320704,279039
Mission: Impossible – The Final Reckoning | Official Trailer (2025 Movie) - Tom Cruise,Paramount Pictures,8714165,124824
"The First Dire Wolf Howl in Over 10,000 Years",Colossal Biosciences,877045,29402
THE PHOENICIAN SCHEME - Official Trailer [HD] - Only in Theaters May 30,Focus Features,4642525,24833
Scientists Bring the Dire Wolf Back from Extinction,JRE Clips,1229770,34477
No Longer Extinct? Colossal Biosciences' Dire Wolf Project,TIME,724845,25059
I THREW MY DREAM BIRTHDAY PARTY...😭,ADAM RAY OKAY,185217,12113
FEEDING STARVING CELEBRITIES FT. SKETCH,Quenlin Blackwell,1142422,77799
